Code	Name	LOC URL	Landmarks	Map Text	In English	JVG Mills
nanji-damianshan	Nanji to Damianshan	https://www.loc.gov/resource/g7821rm.gct00058/?sp=6&r=0.602,0.778,0.085,0.104,90		用丑艮針，二更船取《東洛山》。 用丑艮針，一更船平《中界山》及《黄山》。 用癸丑針，三更船取《狹山》外過。 用癸丑針，三更船平《直谷山》。 用癸丑針，二更船取《羊琪山》及《大陳》《三母山》。 用子癸針，二更船取《東西岳山》。 用子癸針，三更船取《檀(佛)頭山》外過。 對開有礁内外過船。 東北邊有沉礁打辰，子細內外過船。	Following the course 37.5º (丑艮, NNE), sail 4.8 hours to reach Dongluoshan. Following the course 37.5º (丑艮, NNE), sail 2.4 hours until even with Zhongjieshan and Huangshan. Following the course 22.5º (癸丑, NNE), sail 7.2 hours to pass outside Dishan. Following the course 22.5º (癸丑, NNE), sail 7.2 hours until even with Jigu Island. Following the course 22.5º (癸丑, NNE), sail 4.8 hours to reach Yangqishan, Xiadachen Island, and Shangdachen Island. Following the course 7.5º (子癸, NNE), sail 4.8 hours to reach the Dongji Islands. Following the course 7.5º (子癸, NNE), sail 7.2 hours to pass outside Tantoushan. There is a reef far outside. Sail inside or outside. The northeast side has a sunken reef making waves, sail inside or outside carefully.	Steer 30-45 degrees. After 2 watches the ship makes Dongleshan (Beijishan) Steer 30-45 degrees. After 1 watch the ship is level with Zhongjieshan (Beiceshan?) and Huangshan (Banmianshan?) Steer 15-30 degrees. After 3 watches the ship makes Xiashan (Pishan), 28º 05' N, and passes outside it. Steer 15-30 degrees. After 3 watches the ship is level with Zhigushan (28º 23' N) Steer 15-30 degrees. After 2 watches the ship makes Yangqishan (Pingfengshan) and Dachen (Xia Da chen shan) and Sanmushan (Shang Da chen shan) Steer 0-15 degrees. After 2 watches the ship makes Dong Xi Qishan (Dongjishan and Gaodao) Steer 0-15 degrees. After 3 watches the ship makes Dantoushan (29º 10' N), and passes outside it; Appearing opposite is a rock; the ship can pass inside or outside it; on the northeast side there is a sunken rock on which the waves break, [navigate] carefully; the ship can pass inside or outside it.
damianshan-nanhuizui	Damianshan to Taicang Port	https://www.loc.gov/resource/g7821rm.gct00058/?sp=4&r=0.037,0.666,0.069,0.086,90		用子癸針，三更船取《九山》及《乱礁洋》。 用壬子針，二更船過順《孝(順)洋》取《雙嶼港》。 用癸丑針，一更船取《昇羅嶼》《廟州門》刈過轄《碕頭》。 用辛戌針，一更船取《大磨山》。 用乾亥針，二更船出《西後門》。 用丹子針，取《(東)霍山》。 用丹子及子癸針，三更船取《灘山》。 用癸丑針，三更船取《七山》。 用乾亥針，四更船見《茶山》。 用酉辛針，三更船取《南滙嘴》收汧平宝山。 用辛酉針，三更船取《吳淞江》到《太倉港口》軗系船。	Following the course 7.5º (子癸, NNE), sail 7.2 hours to reach Jiushan and Chaos Reef. Following the course 352.5° (壬子, NNW), sail 4.8 hours to pass Xiaoyang and Shuangyu Port. Following the course 22.5° (癸丑, NNE), sail 2.4 hours to reach Shengluo Island, Miaozhou Gate, & [unknown]. Following the course 292.5° (辛戌, WNW), sail 2.4 hours to reach Damoshan. Following the course 322.5° (乾亥, NNW), sail 4.8 hours to exit Blackwell Pass. Sail due north to reach Lingshan. Following the course 7.5° (子癸, NNE), sail 7.2 hours to reach Tanhu Island. Following the course 22.5° (癸丑, NNE), sail 7.2 hours to reach Qishan Islands. Following the course 322.5° (乾亥, NNW), sail 9.6 hours to reach Chashan. Following the course 277.5° (酉辛, WNW), sail 7.2 hours to reach a point level with Nanhuizui. 	Steer 0-15 degrees. After 3 watches the ship makes Jiushan (29º 26' N) and Luanjiaoyang (southern portion of Niubishan Channel) Steer 345-360 degrees. After 2 watches the ship passes Xiaoshanyang (northern portion of Niubishan channel), and makes Shuangxujiang (Duffield pass). Steer 15-30 degrees. After 1 watch the ship makes Shenglexu (Xingleshan) and Miaozhoumen (the channel between Roundabout island and the coast), passes within the latter and goes round Qitou (29º 53' N). Steer 285-300 degrees. After 1 watch the ship makes Damoshan (Damaoshan). Steer 315-330 degrees. After 2 watches the ship goes out through Xihoumen (Blackwall pass). Steer exactly 0 degrees and make Heshan (Dongheshan, 30º 15' N). Steer exactly 0 degrees, and then 0-15 degrees. After 3 watches the ship makes Tanshan (Tanhushan). Steer 15-30 degrees. After 3 watches the ship makes Qishan (Daqishan, 30º 48' N) Steer 315-330 degrees. After 4 watches the ship sights Chashan. Steer 285-270 degrees. After 3 watches the ship makes Nanhuizui, leaves the main, and comes level with Baoshan (Zhaobaoshan, near Gaoqiao).
sumatra-ambergris	Sumatra to Ambergris	https://www.loc.gov/resource/g7821rm.gct00058/?sp=16&r=0.673,0.472,0.083,0.125,270		《蘇門答剌》開船，用乾戍針，十二更，船平《龍涎嶼》。	Sailing from Sumadera Pasai, follow the course 307.5° (乾戍, WNW) for 28.8 hours to sail even with Pulau Breueh.	The ship starts from Sumendala [Kuala Pasai, 97 13' E]; steer 315-300; after 12 watches the ship is level with [f. 18] Longxianxu [Poulo Rondo, 95 07' E]
andaman-1	Longxianyu to Ceylon via Nicobar	https://www.loc.gov/resource/g7821rm.gct00058/?sp=16&r=0.221,0.411,0.083,0.125,270		《龍涎嶼》開船時月，用辛戍針，十更船見《翠藍嶼》。 用辛針，三十更船。 用辛酉針，五十更船見《錫蘭山》。	When starting from Longxianyu, follow the course 292.5° (辛戍, WNW), sailing for 24 hours to see Great Nicobar Island. Following the course 285° (辛, WNW), sail 3 days. Following the course 277.5° (辛酉, WNW), sail 5 days to see Ceylon.	The ship starts from Longxian xu [Poulo Rondo] during a favourable month; steer 285-300; after 10 [f. 18v] watches the ship sees Cuilan xu [Nicobar islands]. Steer exactly 285 for 30 watches; [then] the ship steers 285-270 for 50 watches, and the ship sees Xilan [f. 19] shan [Ceylon].
andaman-2	Longxianyu to Ceylon (direct)	https://www.loc.gov/resource/g7821rm.gct00058/?sp=16&r=0.199,0.433,0.083,0.125,270		《龍涎嶼》開船過洋，用丹辛針，四十更船。 又用辛酉針，五十更船見《錫蘭山》。	When starting cross-sea from Longxianyu, follow the course 292.5° (辛戌, WNW), sailing for 4 days. Then, follow the course 277.5° (辛酉, WNW), sailing 5 days to see Ceylon.	The ship starts from Longxian xu [Poulo Rondo] and crosses the ocean. Steer exactly 285 [f. 18v] for 40 watches; the ship again steers 285-270 for 50 watches; [then] the ship sees Xilan shan [Ceylon].
sri-lanka	Around Ceylon	https://www.loc.gov/resource/g7821rm.gct00058/?sp=18&r=0.916,0.599,0.083,0.126,270		干千《佛堂》，用丹庚針。	From the Ten Thousand Buddha temple, follow the course 255° (庚, WSW).	From Fuotang [Dondra head] steer exactly 255.
colombo-male	To Malé	https://www.loc.gov/resource/g7821rm.gct00058/?sp=18&r=0.724,0.529,0.126,0.083,0		用庚酉針四十五更船取《官嶼》。	Following the course 262.5° (庚酉, WSW), sail 36 hours to reach Malé.	Steer 255-270; after 45 watches make Guanxu [Male island].
male-mogadishu	Malé to Ras Ma'bar	https://www.loc.gov/resource/g7821rm.gct00058/?sp=18&r=0.69,0.641,0.083,0.126,270		《官嶼》澑，用庚酉針，一百五十更船取《木骨都(束)》。	Passing Malé, following the course 262.5° (庚酉, WSW), sail 15 days to reach Mogadishu.	From Guanxu liu [Male island], steer 255-270; after 150 watches the ship makes Mugudu [Mugudushu, Mogadishu].
colombo-renbuzhi	Colombo to Maldives atolls	https://www.loc.gov/resource/g7821rm.gct00058/?sp=18&r=0.726,0.521,0.084,0.163,270		用辛酉(針)，四十五更(船)取《任不知(溜)》。	Following the course 277.5° (辛酉, WNW), sail 4.5 days to reach the Maldives atolls.	Steer 285-270; after 45 watches make Renbuzhi [Fadiffolu atoll].
colombo-kelaa	Colombo to Kelaa	https://www.loc.gov/resource/g7821rm.gct00058/?sp=18&r=0.715,0.507,0.084,0.163,270		用辛戌針，五十更(船)，取《起來(溜)》。	Following the course 292.5° (辛戍, WNW), sail 5 days to reach Kelaa.	Steer 285-300; after 50 watches make Qilai [Kelai island].
colombo-gapingnian	Colombo to Gapingnian	https://www.loc.gov/resource/g7821rm.gct00058/?sp=18&r=0.702,0.494,0.084,0.163,270		用丹戌針，五十五更(船)，取《加平年(溜)》。	Following the course 300° (戌, WNW), sail 5.5 days to reach the Gapingnian Passage.	Steer exactly 300; after 55 watches make Jiapingnian [Kalpeni atoll].
male-gambari	Malé to Gambari	https://www.loc.gov/resource/g7821rm.gct00058/?sp=18&r=0.608,0.514,0.163,0.084,180		用甲卯針，二十九更船，取《甘巴里(頭)》。	Following the course 82.5° (甲卯, ENE), sail 70 hours to reach Gambari.	Steer 75-90; after 29 watches the ship makes Ganbali [Cape Comorin].
male-quilon	Malé to Kollam	https://www.loc.gov/resource/g7821rm.gct00058/?sp=18&r=0.556,0.515,0.163,0.084,180		用丹甲針，四十五更船，取《小葛蘭》。	Following the course 75° (甲, ENE), sail 4.5 days to reach Kollam.	Steer exactly 75; after 45 watches the ship makes Xiao Gelan [Quilon].
gapingnian-cochin	Gapingnian Passage to Kochi	https://www.loc.gov/resource/g7821rm.gct00058/?sp=18&r=0.278,0.533,0.163,0.084,180		用乙卯針，二十五更(船)，取《柯枝國》。	Following the course 97.5° (乙卯, ESE), sail 60 hours to reach Kochi.	[Steer] 60; after 25 watches you make Kezhi [Cochin].
gapingnian-calicut	Gapingnian Passage to Calicut	https://www.loc.gov/resource/g7821rm.gct00058/?sp=18&r=0.259,0.534,0.163,0.084,180		用甲卯針，二十八更船，取《古里國》。	Following the course 82.5° (甲卯, ENE), sail 67.2 hours to reach Kozhikode.	Steer 75-90; after 28 watches the ship reaches the country of Guli [Calicut].
african-coast	African Coast to Hafun	https://www.loc.gov/resource/g7821rm.gct00058/?sp=18&r=0.922,0.73,0.084,0.163,270		在華蓋星五指內， 去到北長星四指坐斗上山扮 坐癸丑針，六十五更船，取《葛兒得風》《哈甫兒》雨	At 5.4° S latitude, go to 10.3° N, follow on the star [unknown] Following the course 22.5° (癸丑, NNE), sail for 6.5 days to reach Cape Guardafui and Hafun.	
andouli-kavaratti	Andouli to Kavaratti	https://www.loc.gov/resource/g7821rm.gct00058/?sp=18&r=0.089,0.483,0.084,0.163,90		用卯針，十六更船，取《加加溜》。	Following the course 90° (卯, east), sail 38.4 hours to reach Kavaratti Island.	
andouli-calicut	Andouli to Calicut	https://www.loc.gov/resource/g7821rm.gct00058/?sp=18&r=0.075,0.476,0.084,0.163,90		用卯針，十五更船，取《古里國》。	Following the course 90° (卯, east), sail 36 hours to reach Kozhikode.	
unknown-calicut	Mangalore to Calicut	https://www.loc.gov/resource/g7821rm.gct00058/?sp=18&r=0.011,0.392,0.084,0.163,90		用丹乙針，二十八更(船)，收《古里國》。	Following the course 105° (乙, ESE), sail 67.2 hours to reach Kozhikode.	
three-six-fingers	TBD	https://www.loc.gov/resource/g7821rm.gct00058/?sp=19&r=0.897,0.476,0.084,0.162,270		在三指觜角山勢去到六指二角，直遶那里寅上。 又在六指二角內山指坐布司上。 用丹艮(針)，十指去到十一指坐取船。	At 9.7° N latitude [unknown]  go to 14.3° N latitude there ... Then, at 14.3° N latitude in the mountain, follow the latitude to city government[?] Following the course 45° (艮, NE), from 20.0° N latitude go to 20.4° N.	
mangalore-qalhat	Mangalore to Qalhat	https://www.loc.gov/resource/g7821rm.gct00058/?sp=19&r=0.823,0.41,0.084,0.162,270		用丹戌針，八十五更(船) 又用辛戌針，四十更船收《加剌哈》。	Following the course 300° (戌, WNW), sail 8.5 days. Then, following the course 292.5° (辛戍, WNW), sail 4 days to reach Qalhat.	
anjediva-a	Anjediva to Qalhat (A)	https://www.loc.gov/resource/g7821rm.gct00058/?sp=19&r=0.79,0.387,0.084,0.162,270		用辛戌針，一百更船收《加剌哈》。	Following the course 292.5° (辛戍, WNW), sail 10 days to reach Qalhat.	
anjediva-b	Anjediva to Qalhat (B)	https://www.loc.gov/resource/g7821rm.gct00058/?sp=19&r=0.741,0.39,0.084,0.162,270		用丹戌針，一百二更船收《加剌哈》。	Following the course 300° (戌, WNW), sail 10.2 days to reach Qalhat.	
goa-qalhat	Goa to Qalhat	https://www.loc.gov/resource/g7821rm.gct00058/?sp=19&r=0.702,0.37,0.084,0.162,270		用辛酉針，八十七更船收《加剌哈》。	Following the course 277.5° (辛酉, WNW), sail 8.7 days to reach Qalhat.	
nine-fingers	TBD	https://www.loc.gov/resource/g7821rm.gct00058/?sp=19&r=0.34,0.394,0.083,0.102,270		九指二角，用丹辛針，一百六十六更船收《都里馬新富》。	From 19.2° N latitude, following the course 285° (辛, WNW), sail 16.6 days to reach ...	
pakistan-coast	TBD	https://www.loc.gov/resource/g7821rm.gct00058/?sp=19&r=0.352,0.378,0.083,0.102,270		此角頭也有十指 在十指山執力 去到十二指《吳實記落》 不到丹戌	This penisula also has latitude 20.0° N. At 20.0° N latitude [unknown] Go to 23.2° N latitude [unknown] Do not go to the course  300° (戌, WNW).	
oman-coast	TBD	https://www.loc.gov/resource/g7821rm.gct00058/?sp=19&r=0.404,0.591,0.1,0.123,270		指坐布司上，用丹艮(針)， 十指去到十一指坐取船。	?-finger on 布司 (Pegasus?) use bearing 艮 (45°, NE) From 20.0° N latitude, sail to 21.6° N [something about riding...].	
gulf-of-oman	TBD	https://www.loc.gov/resource/g7821rm.gct00058/?sp=20&r=0.908,0.441,0.084,0.163,270		觜頭去到十二指 坐乾亥小斗落， 又在十二指觜頭去到十二指二角 坐乾丹布司落 又去到十二指此角頭 子針五十更船收《忽魯莫斯》	From Orion above (?) go to the 12-finger parallel (23.2° N), ride towards 乾亥 (322.5°, NNW) small Sagittarius & falling Orion (?). At the 12-finger parallel (23.2° N) go to 12.5 fingers toward Pu-ssu star and 子 (due North) for fifty watches, ship arrives at Hormuz.	
near-hormuz	TBD	https://www.loc.gov/resource/g7821rm.gct00058/?sp=20&r=0.247,0.584,0.163,0.084,0		去十三指二角坐正北，	Go to 25.6° N latitude and ride it straight across.	
minicoy-calicut	Minicoy to Calicut	https://www.loc.gov/resource/g7821rm.gct00058/?sp=18&r=0.417,0.47,0.084,0.163,270		船收《古里國》 寅針五十更	Sail to Kozhikode, 60° (寅, ENE) for 5 days,	
minicoy-cochin	Minicoy to Cochin	https://www.loc.gov/resource/g7821rm.gct00058/?sp=18&r=0.417,0.47,0.084,0.163,270		寅針二十五更 收《柯枝》	60° (寅, ENE) for 2 days, Arrive Kochi.	
						[There is a hiatus in respect of the voyage to Ling shan [Cape Varella]; 'Shunfeng' gives the stages as 5 watches from Chikan shan [Point Ke Ga] to Luowantou [Cape Padaran, 11 22' N], 5 watches to Qienanmao shan [Hon Heo mountain, 12 24' N, 109 16 E], 3 watches to Ling shan [Cape Varella, 12 54' N].]
						[Since Zheng He or his delegate often went to Thailand, we set out the main stages (as given in 'Shun-feng') for the voyages from Grand Condore to Thailand and thence to Pedra Branca on the main route to India. From Kunlun shan [Grand Condore, 106 36' E], 3 watches to Xiao Kunlun shan [The Brothers, 106 07' E]; 8 watches to Zhenxu shan [Non Khoai, 104 49' E]. From Zhenxu shan, 10 watches to Daheng shan [Poulo Panjang, 103 23' E]; 5 watches to Xiaoheng shan [Poulo Wai, 102 51' E]; 20 watches to Bijiashan [Khao Samroiyot 12 14' N]; 10 watches to Wuniqian [the mudbank off Hlaem Phak Bia, 13 01' N]. From Wuniqian, 3 watches to Zhuxu [the mudbank off Ban Hlaem village, 13 12' N]; and 5 watches to the shallows [off Maenam Mae Klong, 13 21' N]. On the southward journey ships followed the coast from KhaoSamroiyou; 5 watches to Guishan [Ko Hluam, 11 45' N]; 10 watches to Fuoxu [Ko lang, 10 51' N]. From Fuoxu, 10 watches to Da Sumeishan [Ko Samui, 9 27' N]; 15 watches to Daimeishan [Ko Krah, 8 25' N]; 10 watches to Suguna [Songkhla, 7 11' N]; 5 watches to Danijiang kou [Pattani river estuary, 6 54' N]. From Danijiang kou, 7 watches to Jilandan jiangkou [Kelantan river estuary, 6 11' N]; 4 watches to Sanjuexu [Pulau Perhentian Besar, 5 53' N]. From Sanjuexu, 3 watches to Jueyuanshan [Pulau Bidong Laut, 5 36' N]. From Jueyuanshan, 3 watches to Mianhuaxu [Pulau Kapas, 5 12' N]; 5 watches to Douxu [Pulau Tenggol, 4 49' N]; 5 watches to Pengheng jiangkou [Pahang river estuary, 3 31' N]; 5 watches to Qupan shan [Pulau Tioman, 2 46' N]. From Qupanshan, 11 watches to Baijiao [Pedra Branca, 1 19' N].
						From Jilimen [Little Karimun island, 103 24' E], for 5 watches the ship steers 105-120 and [then] exactly 120, makes Changyao xu [Pulau Satumu, Raffles Lighthouse], and goes out through Longya strait. From Longya strait, steering 75-90 [f. 15] for 5 watches, the ship makes Baijiao [Pedra Branca, 104 24' E].
						[The map contains no sailing directions; we can, however, set out the main stages derived from other sources. From Ling shan [Cape Varella, 12 54' N] 13 watches to Dongxidong [Great Catwick and Poulo Sapatu, 9 59' N]; 45 watches to Dongshelong shan [Tandjung Datu, 2 05' N]; 11 watches to Jialimada [Karimata island, 1 36' S]; 10 watches to Jiaolan shan [Gelam islet, 2 53' S]; 30 watches to Jilimen shan [Karimundjawa islands, 5 52' S]; 4 watches to Baolao'an shan [Djapara mountain, that is, Murjo Pegunungan, 6 35' S, 110 52' E]; 8 watches to Nacan shan [Lasem Pegunungan, 111 31' E]; 2 watches to Duban shan [Tuban, 112 04' E]; and 5 watches to Xincun [Gresik, 7 09' S, 112 39' E], or alternatively to Raodong [Jaratan].]
						[The map contains no sailing directions. 'Shun-feng' (ff. 43-5) gives directions for voyages from Atjeh in Sumatra in Banten in Java, and we attempt a provisional explanation of the main stages. From Aqi [Atjeh, Kutaradja], 1 watch to Mantu mountain [Udjung Masam Muka, 5 35' N, 95 13' E]], 39 watches to Maolu [Barus, 2 01' N], 19 watches to Kuxin man anchorage [Tiku, 0 23' S], 3 watches to Zhiqumian [Pariaman, 0 42' S], 3 watches to Jializai man [Padang, 0 57' S], 11 watches to Jiliman [Inderapura, 2 04' S], 14 watches to Foulu luo [Bengkulu, 3 47' S], 19 watches to Jiliman xu [Batu Ketjil island, 5 53' S, 104 27' E]], 5 watches to Fouluwu xu [Sebesi island in Sunda strait, 105 29' E], 3 watches to Foulu shang xiang [Sangian island, 105 50' E], 4 watches to the great mountain of Shigong [Gede mountain near Tandjung Sekong, 5 54' S, 105 59' E]], thence to Pan-jang [Pandjang island, 5 55' S] in Banten bay.
						[The map contains no sailing directions for the west coast of Thailand and Burma with the Nicobar and Andeman islands. The 'Shun-feng' (f. 46) gives the stages for the journey from Kuala Pasai to Chittagong, and we attempt a provisional explanation. From Kuala Pasai, 12 watches to Qienanmao shan [Poulo Weh], 45 watches to the 'southern head mountain' of Andeman [Mount Mayo, 11 23' N, on Rutland island], 12 watches to Pingzhongjian [Saddle Hill,, 13 09' N, on North Andaman island], 50 watches to Chitu shan [South cliff, 21 20' N, on the coast of Burma], 5 watches to Rangliedang head [Patenga point, 22 13' N, associated with 'Juldia' hill], near Chadijiang [Chittagong].
						[Huang Shengzeng (Xiyang chaogong dianlu, ch. 2, ff. 7-7v) records an interesting itinerary from Bengal to Male island, which we paraphrase and summarize. From Bengal the navigator descends to latitudes where the altitude of Polaris is, successively, 4.5 fingers, 3.5 fingers, 2 3/8 fingers, 2 1/8 fingers, 1 7/8 fingers, and 1 3/4 fingers; then he passes Yinggezui [Namunakuli in Ceylon] mountain; after 5 watches he sees Tiezhen island [Great Basses reef]; after another 7 watches he sees Fuoshzuo mountain [Dondra head]; after anohter 5 watches he sees the mountain of Yali [Galle]; whence he travels to Guanxu [Male island in the Maldives].]