Code	Name	LOC URL	Landmarks	Map Text	In English	JVG Mills
shipyard-taicang	Nanjing to Taicang	https://www.loc.gov/resource/g7821rm.gct00058/?sp=1&r=0.643,0.538,0.251,0.13,0			[No guidance, since pilots can follow the banks of the river]	
taicang-nanhuizui	Taicang to Nanhuizui	https://www.loc.gov/resource/g7821rm.gct00058/?sp=3&r=0.354,0.425,0.127,0.107,0	太倉,吳淞,南匯嘴	《太倉港口》開船，用丹乙針，一更船平《吳淞江》。 用乙卯針，一更船到《南匯嘴》。	Starting from Taicang Harbor (太倉港口), sail on a course of 105° (乙, ESE) for 2.4 hours (1 更) until even with Huangpu River (吳淞江). Sail on a course of 97.5° (乙卯, ESE) for 2.4 hours (1 更) to reach Nanhuizui (南匯嘴).	The ship starts from Taicangjiang [Liuhe], and steers exactly 105 degrees; after 1 watch the ship is level with Wusongjiang [Wusong bar]. Steer 105 degrees-90 degrees; after 1 watch, the ship reaches Nanhuicui.
zhaobaoshan-jiushan	Zhaobaoshan to Jiushan	https://www.loc.gov/resource/g7821rm.gct00058/?sp=3&r=0.244,0.573,0.107,0.127,270	招寶,茶山,大小七山,東霍山,東霍山,西後門,大磨山,小磨山,崎頭,昇羅嶼,雙嶼港,孝順洋,九山	平《招寶》，用乙辰針，三更船出洪。 打水丈六七正路。 見《茶山》在東北。 邊過，用巽巳針，四更船見《大小七山》。 打水六七托。 用坤申及丁未針，三更船取《霍山》。 用丹午針，三更船取《(東)霍山》。 用丹午針，六(更船取)《西後門》。 用巽巳針，三更船取《大磨山》。 用乙辰針，一更船取《小磨山》轄《崎頭》《昇羅嶼》。 用丁未針，一更船出《雙嶼港》。 用丙午針，一更船取《孝順洋》。 一路，打水九托九平。 《九山》對《九山》西南邊，有一沆礁打浪。	When level with Zhaobao (招寶), sail on a course of 112.5º (乙辰, ESE) for 7.2 hours (3 更) to exit the main current. The 5 fathom (6-7 托) contour is the correct course to the mouth of the river. You will sight Sheshan Island (茶山) on the northeast side. After passing it, sail on a course of 142.5º (巽巳, SSE) for 9.6 hours (4 更) until you see Gutzlaff Island (大小七山). Keep your soundings in 5 fathoms (6-7 托). Sail on a course of 232.5º (坤申, WSW) & 202.5º (丁未, SSW) for 7.2 hours to (3 更)  reach Tanhu Island (灘山 mislabeled as 霍山). Following the course 180º (午, due south), sail 7.2 hours to reach Donghuo Island (霍山). Following the course 180º (午, due south), sail  14.4 hours to reach Xihoumen. Following the course 142.5° (巽巳, SSE), sail 7.2 hours to reach Damoshan. Following the course 112.5º (乙辰, ESE), sail 2.4 hours to pass Xiaomoshan, round the Qitou [Ocean], and reach Shengluoyu. Following the course 202.5º (丁未, SSW), sail 2.4 hours to exit Shuangyu Port. Following the course 172.5º (丙午, SSE), sail 2.4 hours through Filial Piety Ocean. All the way, the depth of water is nine to nine and a half 托. From Jiushan and toward the southwest there is a reef making waves.	When level with Zhaobao (near Gaoqiao), steer 105-120 degrees. After 3 watches the ship goes out into the main. Take a sounding 6 or 7 zhang; that is the correct course. You sight Chashan on the northeast side; After passing it steer 135-150 degrees; after 4 watches the ship sights Da (Daqishan, 30o 48' N) and Xiao qishan (Hen and Chicks). Take a sounding, 6 or 7 fathoms. Steer 225-240 degrees, then 195-210 degrees. After 3 watches the ship makes Tanshan (Tanhushan). Steer exactly 180 degrees. After 3 watches the ship makes Heshan (Dongheshan, 30o 15' N). Steering exactly 180 degrees, the ship enters Xihoumen (Blackwall pass). Steer 135-150 degrees; after 3 watches the ship makes Damoshan (Damaoshan, 29o 56' N). Steer 105-120 degrees. After 1 watch the ship makes Xiaomoshan (Xiaomaoshan), rounds Qitou 29o 53' N), and makes Shenglexu (Xingleshan). Steer 195-210 degrees. After 1 watch the ship goes out through Shangxu jiang (Duffield pass). Steer 165-180 degrees. After 1 watch the ship makes Xiaoshunyang (northern portion of Niubishan channel). Take soundings all along the route. The depth is 9 fathoms when you are level with Jiushan (Kueshan) islands. Opposite to Jiushan on the southwest side there is one sunken rock which shows above the water when the waves break on it (Heijiao, Holderness rocks). Navigate the ship carefully in all directions.
jiushan-zhongjieshan	Jiushan to Zhongjieshan	https://www.loc.gov/resource/g7821rm.gct00058/?sp=5&r=0.91,0.596,0.085,0.164,270	檀頭山,江片礁,大佛頭山,東西崎山,羊琪,大陳,三母,直谷山,石塘山,狹山山,黄山,中界山	出水打船仔細，(用)甲辛午針，二更船平《檀頭山》。 東邊有《江片礁》，西邊見《大佛頭山》。 平《東西崎山》，用丁午針，五更船平《羊琪》及《大陳》《三母》。 黄礁前見《直谷山》。 用丁未針，二更船平《石塘山》。 用丁未針，三更船平《狹山山》外渦。 用坤未針，二更船取《黄(礁)山》。 打水十七八托平《中界山》。	Get out of the water carefully in East, West, and South, sail for 4.8 hours to be even with Tantoushan. Jiangpian Reef is on the east side. Look for Dafotoushan on the west side. Even with Dongqishan and Xiqishan, follow the course 187.5º (丁午, SSW) and sail 12 hours to be even with Yangqishan, Dachenshan, and Sanmushan. In front of Yellow Reef, look for Zhigushan. Following the course 202.5º (丁未, SSW), sail for 4.8 hours to be even with Shitangshan. Following the course 202.5º (丁未, SSW), sail for 7.2 hours to be to pass outside Xiashan. Following the course 217.5º (坤未, SSW), sail for 4.8 hours to reach Huang(jiao)shan. Take a sounding to confirm 3m depth; even with Zhongjieshan.	After 2 watches the ship is level with Tantou shan (29º 10' N). On the east side is Jiangbianjiao; on the west side you see Dafoshan (Dafutou). When you are level with Dongxi qi shan (Dong Jishan and Gaodao), steer 195-180 degrees. After 5 watches the ship is level with Yangqi (Pingfeng shan) and Dachen (Xia Da chen shan) and San mu (Shang Da chen shan, 28º 30' N), and Huangjiao (Shangxu). In front you see Zhigushan; steer 195-210 degrees; after 2 watches the ship is level with Shitang shan (Niushan). Steer 195-210 degrees. After 3 watches the ship is level with Xiashan (Pishan, 28º 05' N) and passes it on the outside. Steer 225-210 degrees. After 2 watches the ship is level with Huangshan (Banmianshan?). Take a sounding, 17-18 fathoms. The ship is level with Zhongjieshan (Beiceshan?)
zhongjieshan-furongshan	Zhongjieshan to Furongshan	https://www.loc.gov/resource/g7821rm.gct00058/?sp=6&r=0.916,0.64,0.085,0.165,270	東洛山,南己山,臺山,東乗西乗山,芙蓉山	用坤未針一更船取《東洛山》。 用坤未針一更船取《南己山》外渦船。 用丹坤及坤未針三更船取《臺山》。 打水二十托。 用坤未針三更船取《東乗西乗山》。 用坤未針二更船取《芙蓉山》。	Following the course 217.5º (坤未, SSW), sail for 2.4 hours to reach Dongluoshan. Following the course 217.5º (坤未, SSW), sail for 2.4 hours to pass outside Nanjishan. Following the course 225º (坤, SW), sail for 7.2 hours to reach Taishan Island. Take a sounding to confirm 30m depth. Following the course 217.5º (坤未, SSW), sail for 7.2 hours to reach Dongchengshan & Xichengshan. Following the course 217.5º (坤未, SSW), sail for 4.8 hours to reach Furongshan.	Steer 225-210 degrees. After 1 watch the ship makes Dongleshan (Beijishan).  Steer 225-210 degrees. After 1 watch the ship makes Nanjishan (27º 28' N), and the ship passes outside it. Steer exactly 225 degrees, then 225-210 degrees. After 3 watches the ship makes Taishan (26º 59' N), take a sounding, 20 fathoms. Steer 225-210 degrees, after 3 watches the ship makes Dongqi (Nanshuangdao) and Xiqishan (Beishuangdao).  Steer 225-210 degrees; after 2 watches the ship makes Furongshan (Fuyingshan), and passes outside it. 
hongshan-beijiao	Hongshan to Beijiao	https://www.loc.gov/resource/g7821rm.gct00058/?sp=7&r=0.905,0.54,0.092,0.177,270	洪山,北交	外渦平《洪山》，用坤申針及丹坤針，二更船取《北交》。	Passing outside Hongshan, follow the course 232.5º (坤申, WSW) & 225º (坤, SW) and sail 4.8 hours to reach Beijiao.	When level with Hongshan (Zhizhudao), steer 225-240 degrees and then exactly 225 degrees. After 2 watches the ship makes Beijiao (Beiling sijiao, 26º 22' N)
dongluoshan-xiaoxiyang	Dongluoshan to Xiaoxiyang	https://www.loc.gov/resource/g7821rm.gct00058/?sp=6&r=0.793,0.641,0.085,0.165,270	東洛山門,鳳凰山,南己山,臺山,東乗,芙蓉山,小西洋山	《東洛山門》內過，用庚申及坤申針，一更船平《鳳凰山》過《南己山》。 打水十三托。 用坤未針，三更船取《臺山》內過。 用坤未針，三更船取《東乗》內過。 船取坤未針，二更船取《芙蓉山》內過。 用丁未針，一更船過《小西洋山》。	Passing inside of Dongluoshan, follow the course 247.5º (庚申, WSW) and 232.5º (坤申, WSW), sailing for 2.4 hours to pass Phoenix Mountain and Nanji. Take a sounding to confirm 19.5m depth. Following the course 217.5º (坤未, SSW), sail for 7.2 hours to pass insideTaishan. Following the course 217.5º (坤未, SSW), sail for 7.2 hours to pass inside Dongcheng. Following the course 217.5º (坤未, SSW), sail for 4.8 hours to pass inside Furongshan. Following the course 202.5º (丁未, SSW), sail for 2.4 hours to pass Xiaoxiyang.	Passing within Dongleshan men (the passage westward of Beijishan), steer 255-240 degrees, and then 225-240 degrees. After 1 watch the ship is level with Fenghuangshan (27º 41' N). On passing Nanjishan (27º 28' N) take a sounding 13 fathoms. Steer 225-210 degrees; after 3 watches the ship makes Taishan (26º 59' N) and passes inside it. Steer 225-210 degrees. After 3 watches the ship makes Dongqi (Nanshuangdao), and passes inside it. The ship steers 225-210 degrees, and after 2 watches the ship makes Furongshan (Fuyingshan) and passes inside it. Steer 195-210 degrees. After 1 watch the ship passes Xiao xi yang shan (Isimasidao). 
xiaoxiyang-dinghai	Xiaoxiyang to Dinghai	https://www.loc.gov/resource/g7821rm.gct00058/?sp=7&r=0.713,0.54,0.085,0.163,270	北交頭門,定海	用丁午針，一更船取《北交頭門》。 內過沿山，取《定海》所前過。	Following the course 187.5º (丁午, SSW), sail for 2.4 hours to reach Beijiaotou. Go in, along the island to pass in front of Dinghai.	Steer 195-180 degrees. After 1 watch the ship makes Beijiaotou men (the passage between Beilingisjiao and Beixu (is), 26º 22' N). Pass within it. Follow the mountains, make Dinghaisuo (Dinghaitown) and pass in front of it.
around-wuhushan	Around Wuhushan	https://www.loc.gov/resource/g7821rm.gct00058/?sp=7&r=0.361,0.662,0.085,0.163,270	五虎山	用丁午針，二更船取《五虎山》。	Following the course 187.5º (丁午, SSW), sail for 4.8 hours to reach Wuhushan.	Steer 195-180 degrees. After 2 watches the ship makes Wuhushan (Huangqishan, 26º 05' N).
wuhushan-dongsha	Wuhushan to Niushan	https://www.loc.gov/resource/g7821rm.gct00058/?sp=7&r=0.221,0.647,0.085,0.163,270	官塘,東沙,東沙,牛山	用乙辰針，平《官塘》二礁外渦。 用丙巳針，取《東沙》。 《東沙》用丹巳針，三更船平《牛山》。	Follow the course 112.5º (乙辰, ESE) to pass ouside the Guantang second reef. Follow the course 157.5º (丙巳, SSE) to reach Dongsha.	Steer 105-120 degrees; come level with the two rocks called Guantang (Jixingjiao, 26º 05' N), and pass outside them. Steer 165-150, make Dongsha (Xichuandao). From Dongsha steer exactly 150 degrees; after 3 watches the ship is level with Niushan (25º 25' N).
sumatra-berkey	Samudera Pasai to Berkey	https://www.loc.gov/resource/g7821rm.gct00058/?sp=16&r=0.694,0.509,0.083,0.125,90	蘇門答剌,急水湾,巴碌頭,甘杯港,亞路,單嶼,雙嶼,雞骨嶼	《蘇門答剌》開船， 用丑艮及乙艮針，五更船平《急水湾》。 《巴碌頭》有淺。 用艮巽針，五更船取《甘杯港》。 用艮巽針，十五更船平《亞路》。 用乙艮針，五更船取《單嶼》。 再用艮巽針，四更船取《雙嶼》。 用丹巽及辰巽針，十五更船取《雞骨嶼》。	Sailing from the opening of Samudera Pasai, follow courses 37.5º (丑艮, NNE) and 112.5º (乙辰, ESE), sail 12 hours to even with Meunasah Asan. East Aceh has shallows. Following the course 127.5º (辰巽, ESE), sail for 12 hours to reach Kuala Langsa. Following the course 127.5º (辰巽, ESE), sail for 36 hours to even with Medan. Following the course 112.5º (乙辰, ESE), sail for 12 hours to reach Berhala. Then, follow the course 127.5º (辰巽, ESE), sailing for 9.6 hours to reach Shuangyu. Following courses 135º (巽, SE) and 127.5º (辰巽, ESE), sail for 36 hours to reach Pulau Berkey.	The ship starts from Sumendala [Kuala Pasai, 97 13' E]; steer 30-45 and [then] 105-120; after 5 watches the ship is level with Jishuiwan [Udjung Djambuaje, 5 15' N] [and then] Balu tou [Udjung Peureula, 4 54' N]; there are shoals.  Steer 120-135; after 5 watches the ship makes Ganbeijiang [Kumpai roadstead, 4 11' N]. Steer 120-135; after 15 watches the ship is level with Yalu [Deli River, 3 47' N]. Steer 105-120; [f. 16v] after 5 watches the ship makes Danxu [Berhala island, 3 46' N]. [f. 17] Again steer 120-135; after 4 watches the ship makes Shuangxu [the Brothers, ca 3 23' N]. Steer exactly 135 and [then] 120 [f. 16v]-135; after 15 watches the ship makes Jiguxu [Aruah islands, 2 53' N].
berkey-malacca	Berkey to Malacca	https://www.loc.gov/resource/g7821rm.gct00058/?sp=15&r=0.557,0.394,0.084,0.126,90	雞骨嶼,綿花淺,綿花(嶼),滿剌加	取《雞骨嶼》，用丹辰及辰乙針，三更船平《綿花淺》。 用乙辰及丹辰針，三更船平《綿花(嶼)》。 用辰巽針，十更船平《滿剌加》。	Reaching Pulau Berkey, follow the courses 120º (辰, ESE) and 112.5º (辰乙, ESE), sailing for 7.2 hours to even with Mianhua Shallows. Following the courses 112.5º (乙艮, ESE) and 120º (辰, ESE), sail for 7.2 hours to even with Mianhua Shallows. Following the course 127.5º (辰巽, ESE), sail for 12 hours to even with Malacca.	After making Jiguxu, steer exactly 120 and [then] 120-105; after 3 watches the ship is level with Mianhua qian [Amazon Maru shoal, 2 51' N]. Steer 105-120 and [then] exactly 120; [f. 16] after 3 watches [f. 16v] the ship is level with Mianhua qian [read Mianhua xu, 'Cotton island', Bukit Jugra, 2 51' N]. Steer 120-135; [f. 16] after 10 watches the ship is level with Manlajia [Malacca, 2 12' N]. 
malacca-kalimun	Malacca to Great Karimun	https://www.loc.gov/resource/g7821rm.gct00058/?sp=14&r=0.07,0.366,0.107,0.127,90	滿剌加,射箭山,毘宋嶼,吉利	《滿剌加》開船，用辰巽針，五更船平《射箭山》。 用辰巽針，三更船平《毘宋嶼》。 用丹巽針，取《吉利》。	From the entrance to Malacca, follow the course 127.5º (辰巽, ESE), sailing for 12 hours to be even with Mount Banang. Following the course 127.5º (辰巽, ESE), sail 7.2 hours to be even with Banana Island. Follow the course 135º (巽, SE) to reach Great Karimun.	The ship starts from Manlajia; steer 120-135; after 5 watches the ship is level with Shejianshan [Bukit Banang, 1 48' N]. Steer 120-135; after 3 watches the ship is level with Pisongxu [Pulau Pisang, 1 28' N]. Steer exactly 135, and make Jili [read Jilimen, Little Karimun island, 1 08' N].
kalimun-longyamen	Great Karimun to Longyamen	https://www.loc.gov/resource/g7821rm.gct00058/?sp=14&r=0.491,0.436,0.107,0.127,90		《吉利》門五更船，用乙辰及丹辰針，取《長腰嶼》。 出《龍牙門》。	Karimun Gate is 12 hours sailing, folllowing the course 112.5º (乙辰, ESE) and 120º (辰, ESE) to reach Pulau Senang. Exit at Longyamen.	From Jilimen [Little Karimun island, 103 24' E], for 5 watches the ship steers 105-120 and [then] exactly 120, makes Changyao xu [Pulau Satumu, Raffles Lighthouse], and goes out through Longya strait. 
longyamen-baijiao	Longyamen to Baijiao	https://www.loc.gov/resource/g7821rm.gct00058/?sp=14&r=0.832,0.353,0.107,0.127,90		《龍牙門》，用甲卯針，五更船取《白礁》。	From Longyamen, following the course 82.5º (甲卯, ENE), sail 12 hours to reach Baijiao.	From Longya strait, steering 75-90 [f. 15] for 5 watches, the ship makes Baijiao [Pedra Branca, 104 24' E].
baijiao-dongzhushan	Baijiao to Dongzhushan	https://www.loc.gov/resource/g7821rm.gct00058/?sp=13&r=0.018,0.338,0.107,0.127,90		《白礁》過用癸丑及丹癸針五更船平《東竹山》外過。	When passing Baijiao, following the course 127.5º (辰巽, ESE), sail 12 hours to pass outside Dongzhushan.	After passing Baijiao [Pedra Branca, 1º 19' N] steer 15º-30º and [then] exactly 15º; after 5 watches the ship is level with Dongzhu shan [Pulau Aur, 2º 26' N], and passes outside it. 
dongzhushan-kunlun	Dongzhushan to Kunlun	https://www.loc.gov/resource/g7821rm.gct00058/?sp=13&r=0.33,0.344,0.085,0.164,90		《東竹山》過，用子丑及丹癸針，船取《崑崙山》外過。	When passing Dongzhushan follow courses 352.5º (子丑???, NNW) and 15º (癸, NNE), sailing to pass outside Kunlun.	After passing Dongzhu shan, steer 0-30 and [then] exactly 15; [f 14v] the ship makes Kunlun shan [Grand Condore, 8 41' N], and passes outside it. [f. 13]
kunlun-kega	Kunlun to Kê Gà	https://www.loc.gov/resource/g7821rm.gct00058/?sp=11&r=0.123,0.523,0.084,0.103,90		《崑崙山》外渦，用癸丑針，十五更船取《赤坎山》。 用丑艮及丹艮。	When passing outside Kunlun, follow the course 22.5º (癸丑, NNW), sailing 36 hours to reach Kê Gà. Follow courses 37.5º (丑艮, NNE) and 45º (艮, NE).	After passing on the outside of Kunlun shan steer 15-30; after 15 watches the ship makes Chikan shan [Point Ke Ga, 10 41' N, 107 59' E]. Steer 30-45 and [then] exactly 45
northbound-page-11-b	Đá Bia Mountain to Phương Mai	https://www.loc.gov/resource/g7821rm.gct00058/?sp=11&r=0.749,0.605,0.085,0.163,90		《靈山》，用壬子及丹壬針，五更船平《洋嶼》取《筊杯山(嶼)》。	From Đá Bia Mountain, following courses 352.5º (壬子, NNW) and 345º (壬, NNW), sail 12 hours until even with Cu Lao Xanh to reach Phương Mai.	[f. 12v] From Lingshan steer 345-360 and [then] exactly 345; after 5 watches the ship [f 12] is level with Yangxu [Poulo Gambir, 13 37' N], and [then] makes Jiaobeishan [Nui Ong Co and Nui Ong Can, 13 54' N].
northbound-page-10-a	Phương Mai to Cù-Lao Ré	https://www.loc.gov/resource/g7821rm.gct00058/?sp=10&r=0.197,0.731,0.109,0.134,90		《筊杯山(嶼)》，用壬子針，七更船取《外羅山》外過。	From Phương Mai, following the course 352.5º (壬子, NNW), sail 21.6 hours to pass outside Cù-Lao Ré.	From Jiaobeishan steer 345-360; after 7 watches the ship makes Wailuoshan [Culao Re, 15 23' N], and passes outside it.
northbound-page-10-b	Cù-Lao Ré to Duzhushan	https://www.loc.gov/resource/g7821rm.gct00058/?sp=10&r=0.697,0.685,0.084,0.103,90		《外羅山》內過，(用)癸丑及单癸針，二十一更船平《獨豬山》。	When passing outside Cù-Lao Ré, follow courses 22.5º (癸丑, NNW) and 15º (癸, NNE), sailing 50.4 hours until even with Duzhushan.	[f 11v] Passing on the inside of Wailuoshan, [steer] 15-30 and [then] exactly 15; after 21 watches the ship is level with Duzhushan [Dazhoudao, 18 40' N, 110 28' E].
northbound-page-9-a	Duzhushan to Daxingjian	https://www.loc.gov/resource/g7821rm.gct00058/?sp=9&r=0.13,0.664,0.084,0.104,90		《獨豬山》，(用)丹艮針，五更船。 用艮寅針，十更船平《大星尖》外過。	From Duzhushan, following the course 45º (艮, NE), sail 12 hours. Following the course 52.5º (艮寅, ENE), sail 24 hours to pass outside Daxingjian.	From Duzhushan (Dazhoudao, 18º 40' N, 110º 28' E), steer exactly 45 degrees for 5 watches; the ship steers 45-60 degrees for 10 watches, [other books indicate that the total of 15 watches shold be changed to 25.] comes level with Daxingjian (Pedro Blanco, 22º 19' N), and passes outside it.
northbound-page-9-b	Daxingjian to Dawushan	https://www.loc.gov/resource/g7821rm.gct00058/?sp=9&r=0.583,0.652,0.084,0.104,90		《大星尖》，用丹寅針，十五更船平《南粵山》。 《外平山》外過，用寅針，三更船平《大甘》《小甘》外過。 用丹艮針，四更船平《大武山》。	From Daxingjian, following the course 60º (寅, ENE), sail 36 hours until even with Nan'ao Island. Passing outside Waipingshan, follow the course 60º (寅, ENE), sailing 7.6 hours to pass outside Dagan and Xiaogan. Following the course 45º (艮, NE), sail 9.6 hours until even with Dawushan.	From Daxingjian steer exactly 60 degrees. After 15 watches the ship is level with Nan'ao shan (23º 25' N) and Waipengshan (Nanpingdao) and passes outside them.  Steer 45 to 60 degrees, after 3 watches the ship is level with Dagan and Xiaogan (Brothers islands, 23º 33' N) and passes outside them.  Steer exactly 45 degrees; after 4 watches the ship is level with Dawushan (24º 20' N). 
northbound-page-8-a	Dawushan to Wuqiushan	https://www.loc.gov/resource/g7821rm.gct00058/?sp=8&r=0.125,0.67,0.091,0.112,90		《大武山》，用丹艮針，七更船平《烏邱山》。	From Dawushan, following the course 45º (艮, NE), sail 21.6 hours until even with Wuqiushan.	From Dawushan steer exactly 45 degrees; after 7 watches the ship is level with Wuqiushan (Wuqiuxu, 24º 59' N).
northbound-page-8-b	Wuqiushan to Dongshashan	https://www.loc.gov/resource/g7821rm.gct00058/?sp=8&r=0.682,0.689,0.085,0.104,90		《烏邱山》，用艮寅針，四更船平《牛山(者)》。 用丑艮針，五更船取《東沙山》。	From Wuqiushan, following the course 52.5º (艮寅, ENE), sail 9.6 hours until even with Niushan. Following the course 37.5º (丑艮, NNE), sail 12 hours to reach Dongshashan.	From Wuqiushan steer 45-60 degrees; after 4 watches the ship is level with Niushan, 25º 25' N. Steer 30-45 degrees. After 5 watches, the ship makes Dongshashan (Xichuandao, 25º 58' N).
northbound-page-7-a	Dongshashan to Wuhu Reef	https://www.loc.gov/resource/g7821rm.gct00058/?sp=7&r=0.095,0.716,0.11,0.135,90		《東沙山》，用丑艮針，一更船平《官塘山》。 用丑艮針，一更船《五虎山》。 用丑艮針，三更船取《龜嶼》。 用丑艮針，一更船取《東湧山》外過。	From Dongshashan, following the course 37.5º (丑艮, NNE), sail 2.4 hours until even with Guantangshan. Following the course 37.5º (丑艮, NNE), sail 2.4 hours to Wuhu Reef. Following the course 37.5º (丑艮, NNE), sail 7.2 hours to Kusu. Following the course 37.5º (丑艮, NNE), sail 2.4 hours to pass outside Dongyongshan.	From Dongshashan steer 30-45 degrees. After 1 watch the ship is level with Guantangshan (Jixingjiao, 26º 05' N). [wrong here; and map is wrong in indicating that Guantangshan is on the east of the course from Dongsha to Guixu.]  Steer 30-45 degrees, after 1 watch the ship makes Wuhushan (Huangqishan).  Steer 30-45 degrees. After 3 watches the ship makes Guixu (Dongsha, 26º 09' N0. Steer 30-45 degrees. After 1 watch the ship makes Dongyongshan (Dongyinshan, 26º 22' N), and passes outside it.
northbound-page-7-b	Dongyongshan to Nanji	https://www.loc.gov/resource/g7821rm.gct00058/?sp=7&r=0.816,0.777,0.084,0.103,90		《東湧山》，用丑艮針，二更船平《東乗山》《西乗山》。 用丑艮針，二更船平《臺山》。 用丑艮針，三更船取《南己》。	From Dongyongshan, following the course 37.5º (丑艮, NNE), sail 4.8 hours until even with Dongchengshan and Xichengshan. Following the course 37.5º (丑艮, NNE), sail 4.8 hours until even with Taishan. Following the course 37.5º (丑艮, NNE), sail 4.8 hours to reach Nanji.	From Dongyongshan steer 30-45 degrees. After 2 watches the ship is level with Dongqishan (Nanshuangdao) and Xiqishan (Beishuangdao). Steer 30-45 degrees. After 2 watches the ship is level with Taishan (26º 59' N Steer 30-45 degrees. After 3 watches the ship makes Nanji (27º 28' N) 
